document_id,subjectCategories,title,abstract,createDate,publicationDate,downloads_pdf,center,copyright,related19660005467,AERODYNAMICS,Experimental stability and drag of a pointed and a blunted 30 deg half-angle cone at Mach numbers from 11.5 to 34 in air,Static and dynamic stability and drag of blunted and pointed cones at various Mach numbers and Reynolds numbers,2013-09-02,1966-01-01,/api/citations/19660005467/downloads/19660005467.pdf,CDMS,GOV_PUBLIC_USE_PERMITTED,
19660005470,CHEMISTRY,Argentic oxysalt electrodes,Silver ions with plus three oxidation states investigated as cathode electrodes in potassium hydroxide with zinc as anodes,2013-09-02,1966-01-01,/api/citations/19660005470/downloads/19660005470.pdf,CDMS,GOV_PUBLIC_USE_PERMITTED,
19660005471,FLUID MECHANICS,Experimental nozzle expansion and flow characteristics of potassium vapor,Nozzle expansion and flow characteristics of potassium vapor,2013-09-02,1966-01-01,/api/citations/19660005471/downloads/19660005471.pdf,CDMS,GOV_PUBLIC_USE_PERMITTED,
19660005479,THERMODYNAMICS AND COMBUSTION,Potassium condensing tests of horizontal multitube convective and radiative condensers operating at vapor temperatures of 1250 deg to 1500 deg F,Potassium condensing tests of horizontal multitube convective and radiative condenser operating at vapor temperatures,2013-09-02,1965-01-01,/api/citations/19660005479/downloads/19660005479.pdf,CDMS,GOV_PUBLIC_USE_PERMITTED,
19660005487,"PHYSICS, PLASMA",Radial density and temperature profiles at the ion cyclotron wave resonance point,Radial density and temperature profiles at ion cyclotron wave resonance point - theory for electrostatic probe in magnetically confined plasma - Langmuir probe,2013-09-02,1966-01-01,/api/citations/19660005487/downloads/19660005487.pdf,CDMS,GOV_PUBLIC_USE_PERMITTED,
19660005612,SPACE SCIENCES,Landing characteristics of the Apollo spacecraft with deployed-heat-shield impact attenuation systems,Impact acceleration and landing system characteristics of Apollo spacecraft command module configurations with deployed heat shield,2013-09-02,1966-01-01,/api/citations/19660005612/downloads/19660005612.pdf,CDMS,GOV_PUBLIC_USE_PERMITTED,20070030975
19660005616,BIOSCIENCES,Photosynthetic halophiles from Owens Lake Final report,"Photosynthetic, halophilic bacteria, Chromatium, growth in water and in sodium salt solutions",2013-08-03,1966-01-01,/api/citations/19660005616/downloads/19660005616.pdf,CDMS,GOV_PUBLIC_USE_PERMITTED,
19660005674,COMMUNICATIONS,A more exact theory of backscattering from statistically rough surfaces,Physical optics and other approximations examined for improving and extending theory of electromagnetic backscattering from rough surfaces,2013-08-03,1965-08-31,/api/citations/19660005674/downloads/19660005674.pdf,CDMS,GOV_PUBLIC_USE_PERMITTED,
19660005735,AUXILIARY SYSTEMS,"Research and development of open cycle fuel cells  Second quarterly progress report, period ending Feb. 15, 1965",Effect of low temperature environment on storage of fuel cell power supply - computer program for fuel cell system parameter optimization - mathematical model of static moisture removal,2013-08-03,1965-03-15,/api/citations/19660005735/downloads/19660005735.pdf,CDMS,GOV_PUBLIC_USE_PERMITTED,
19660005764,"PHYSICS, SOLID-STATE",Some Intensity Measurements in the Vacuum Ultraviolet,Intensity measurements in vacuum ultraviolet - photoelectric yields of untreated metals and semiconductors measured by calibrated thermocouple,2013-08-03,1964-06-01,/api/citations/19660005764/downloads/19660005764.pdf,CDMS,GOV_PUBLIC_USE_PERMITTED,
19660005778,"PHYSICS, PLASMA","Experimental and theoretical research on plasma sheaths and boundary layers around stagnation point electrodes  Semiannual progress report no. 2, 1 Jan. - 30 Jun. 1965",Plasma sheaths and boundary layers around stagnation point electrodes,2013-08-03,1965-01-01,/api/citations/19660005778/downloads/19660005778.pdf,CDMS,GOV_PUBLIC_USE_PERMITTED,
19660005940,STRUCTURAL MECHANICS,Investigation of the use of penetrometers to determine the capability of dust materials to support bearing loads,Use of accelerometer-equipped spherical penetrometers to determine capability of dust materials to support bearing loads,2013-09-02,1966-01-01,/api/citations/19660005940/downloads/19660005940.pdf,CDMS,GOV_PUBLIC_USE_PERMITTED,
19660005950,BIOSCIENCES,Experiments suggesting evolution to protein,Evolution of primary structure of proteins and precellular forms - dry heating of amino acid mixture to produce clean polymers,2013-08-03,1964-01-01,/api/citations/19660005950/downloads/19660005950.pdf,CDMS,GOV_PUBLIC_USE_PERMITTED,
19660005957,METEOROLOGY,The interpretation of TIROS radiation data for practical use in synoptic weather analysis,Interpretation of TIROS III radiation data to demonstrate practical applications in synoptic weather analyses,2013-09-02,1964-01-01,/api/citations/19660005957/downloads/19660005957.pdf,CDMS,GOV_PUBLIC_USE_PERMITTED,
19660006008,INSTRUMENTATION AND PHOTOGRAPHY,Image Contrast and Phase Modulated Light Methods in Polarization and Inteference Microscopy.  Instruction Manual for the PAR EPM-1 Photoelectric Polarizing and Interference Microscope,"Phase retardation measurements in polarization and interference microscopy, theory and application of phase modulated light methods, and design of photoelectric microscope",2013-08-03,1964-01-01,/api/citations/19660006008/downloads/19660006008.pdf,CDMS,GOV_PUBLIC_USE_PERMITTED,
19660006033,SPACE SCIENCES,"Evolution II - from the Main Sequence Through Core Helium Burning, M Equals 3M Sun Masses",Evolution of three solar mass star from main sequence to red giant,2013-08-03,1964-01-01,/api/citations/19660006033/downloads/19660006033.pdf,CDMS,GOV_PUBLIC_USE_PERMITTED,
19660006034,MATHEMATICS,Methods of Quadrature for Euler Transform Integrals,Quadrature methods for Euler transform integrals,2013-08-03,1965-02-22,/api/citations/19660006034/downloads/19660006034.pdf,CDMS,GOV_PUBLIC_USE_PERMITTED,
19660006036,GENERAL,Life in space and humanity on the earth A joint review of five books,"Life in space, astronomy, interstellar communication, interplanetary space, galaxies, and stars",2013-09-02,1964-01-01,/api/citations/19660006036/downloads/19660006036.pdf,CDMS,GOV_PUBLIC_USE_PERMITTED,
19660006049,SPACE SCIENCES,Translational and rotational motion of a body entering the Mars atmosphere,Translational and rotational motion of spherical body entering Mars atmosphere - reentry physics,2013-08-03,1965-12-01,/api/citations/19660006049/downloads/19660006049.pdf,CDMS,GOV_PUBLIC_USE_PERMITTED,
19660006052,"FACILITIES, RESEARCH, AND SUPPORT","Design and analysis of unloading and tiedown systems.  Apollo logistics support systems MOLAB studies  Technical report, 1 Oct. - 7 Dec. 1964",Remote control systems for unloading lunar mobile laboratory from lunar excursion module truck - logistics,2013-08-03,1964-12-01,/api/citations/19660006052/downloads/19660006052.pdf,CDMS,GOV_PUBLIC_USE_PERMITTED,
19660006053,AUXILIARY SYSTEMS,"Development of high energy density primary batteries  First quarterly report, 22 Jun. - 21 Oct. 1965",Electrode and electrolyte studies for lithium- copper fluoride batteries,2013-08-03,1965-12-28,/api/citations/19660006053/downloads/19660006053.pdf,CDMS,GOV_PUBLIC_USE_PERMITTED,
19660006060,BIOTECHNOLOGY,Waste Management and Personal Hygiene for Extended Spacecraft Missions,Waste management and personal hygiene for extended manned spacecraft missions,2013-09-02,1964-01-01,/api/citations/19660006060/downloads/19660006060.pdf,CDMS,GOV_PUBLIC_USE_PERMITTED,
19660006062,THERMODYNAMICS AND COMBUSTION,On associated radial heat expansions,Procedure for obtaining series representation avoiding use of complex expansion in solution of radial heat equation,2013-08-03,1965-09-01,/api/citations/19660006062/downloads/19660006062.pdf,CDMS,GOV_PUBLIC_USE_PERMITTED,
19660006063,SPACE RADIATION,Impulsive emission of approximately 40 KeV electrons from the sun,Impulsive emission of high energy electrons from sun and diffusive propagation through interplanetary medium observed by Mariner IV PARTICLE detectors,2013-08-03,1965-06-01,/api/citations/19660006063/downloads/19660006063.pdf,CDMS,GOV_PUBLIC_USE_PERMITTED,
19660006070,GEOPHYSICS,N2 temperature and density data for the 150 to 300 km region and their implications,Molecular nitrogen density and temperature measurements in thermosphere by thermosphere probe,2013-09-02,1965-12-01,/api/citations/19660006070/downloads/19660006070.pdf,CDMS,GOV_PUBLIC_USE_PERMITTED,
19660006074,FLUID MECHANICS,Analysis of free-molecule flow with surface diffusion through cylindrical tubes,Free molecular flow with surface diffusion through cylindrical tubes,2013-09-02,1966-01-01,/api/citations/19660006074/downloads/19660006074.pdf,CDMS,GOV_PUBLIC_USE_PERMITTED,
19660006079,"FACILITIES, RESEARCH, AND SUPPORT",Economic analysis of Perlite versus super insulation in liquid hydrogen storage and run vessels for the M-1 Program,Cost comparison of perlite and multilayer aluminum foil relective insulation in liquid hydrogen storage dewars for M-1 engine,2013-08-03,1965-10-15,/api/citations/19660006079/downloads/19660006079.pdf,CDMS,GOV_PUBLIC_USE_PERMITTED,
19660006082,SPACE SCIENCES,"The effect of the lunar environment on magma generation, migration, and crystallization, August 13, 1964 - August 20, 1965","Effect of lunar environment on magma generation, migration, and crystallization",2013-08-03,1965-11-01,/api/citations/19660006082/downloads/19660006082.pdf,CDMS,GOV_PUBLIC_USE_PERMITTED,
19660006087,AUXILIARY SYSTEMS,"A theoretical and experimental study of low voltage, high current dc to ac converters which use either magnetoresistors, superconductors, Hall effect devices, or thin-film devices  Final report","Low-voltage, high current dc-ac converter from magnetoresistor, superconductor, Hall effect, or thin-film devices",2013-08-03,1965-12-01,/api/citations/19660006087/downloads/19660006087.pdf,CDMS,GOV_PUBLIC_USE_PERMITTED,
19660006098,"MATERIALS, NONMETALLIC",Some thermophysical property measurements of porous ceramic ''Glassrock'',"Thermophysical properties of porous ceramic material - thermal conductivity, specific heat, density, and porosity measurements",2013-08-03,1965-05-13,/api/citations/19660006098/downloads/19660006098.pdf,CDMS,GOV_PUBLIC_USE_PERMITTED,
19660006101,"PHYSICS, PLASMA",A study of the theory and measurement of plasma diffusion,"Plasma diffusion, dyadic diffusion coefficients, and plasma property measurements using rectangular waveguide",2013-08-03,1965-04-01,/api/citations/19660006101/downloads/19660006101.pdf,CDMS,GOV_PUBLIC_USE_PERMITTED,
19660006104,INSTRUMENTATION AND PHOTOGRAPHY,"Extreme vacuum technology including cryosorption, diffusion pump and pressure calibration studies  Quarterly status report no. 8, 1 May - 1 Aug. 1965","Cryosorption, diffusion pump, and low pressure calibration studies on Penning gauge and cold cathode magnetron",2013-08-03,1965-08-27,/api/citations/19660006104/downloads/19660006104.pdf,CDMS,GOV_PUBLIC_USE_PERMITTED,
19660006110,SPACE SCIENCES,Optimum transfer to Mars via Venus,Thrust maneuver at Venus for optimum Earth-Mars rendezvous trajectory in flyby mission,2013-08-03,1965-04-01,/api/citations/19660006110/downloads/19660006110.pdf,CDMS,GOV_PUBLIC_USE_PERMITTED,
19660006116,AIRCRAFT,"Hydroplaning of aircraft tires  Third quarterly progress report, 15 Apr. - 15 Jul. 1965",Aircraft tire hydroplaning phenomena - static and dynamic testing of polyurethane tire,2013-08-03,1965-07-15,/api/citations/19660006116/downloads/19660006116.pdf,CDMS,GOV_PUBLIC_USE_PERMITTED,
19660006130,STRUCTURAL MECHANICS,Torsional Instability of Cantilevered Bars Subjected to Nonconservative Loading,Cantilever bar torsional instability under nonconservative compression loading,2013-08-03,1964-01-01,/api/citations/19660006130/downloads/19660006130.pdf,CDMS,GOV_PUBLIC_USE_PERMITTED,
19810008199,LIFE SCIENCES (GENERAL),Life of the onion not knowing up from down,The absence of the force of gravity has a negative effect on plant life. Plants grown on spacecraft have died prematurely. Tests are being made to discover whether or not electricity will compensate for the absence of gravitation. It was found that an onion under current is not subject to the force of gravity. Tremendous possibilities are opened up by these experiments.,2013-09-04,1980-08-01,/api/citations/19810008199/downloads/19810008199.pdf,CDMS,PUBLIC_USE_PERMITTED,
19810008203,AEROSPACE MEDICINE,Antibodies to myofibril antigens in cosmonauts after spaceflights,Serum samples obtained from 15 astronauts before and after spaceflights were studied with the use of the indirect immunofluorescent method. In seven astronauts antibodies to different elements of the human heart muscle appeared after flights. Strong and very strong luminescence of the elements of heart muscle tissue was detected in the astronauts after the third space flight. In a study of the sera on sections of bovine heart muscle tissue the reactions of the sera taken before and after flight were found to show no essential differences.,2013-09-04,1980-08-01,/api/citations/19810008203/downloads/19810008203.pdf,CDMS,PUBLIC_USE_PERMITTED,
19810008208,AEROSPACE MEDICINE,Rheoencephalography in Meniere's disease,"Rheoencephalography (REG) was used on 35 patients with Meniere's disease to determine tonus and perfusion of cerebral vessels. The analysis took account of age, duration of the disease and presence or absence of cervical osteochondrosis. Hypertensive symptoms in the vertebro-basilar system predominated in the under 45 age group, while for the over 45 patients and those suffering for more than 5 years, hypertensive symptoms were likewise noted in the internal carotid arterial system. Signs of angiospasm were revealed both for patients with cervical osteochondrosis and without it. Hypertensive signs were noted in 88.5% of patients with Meniere's disease and as a rule they were noted in the entire vertebro-basilar system without respect to the presence or absence of concurrent cervical osteochondrosis and uni- or bilateral affection of the labyrinth; in patients over 45 who had suffered more than 5 years this also applied to the internal carotid arterial system. Identification of the condition of cerebral circulation and the planning of more effective therapy that influences vascular tone is made possible by REG.",2013-09-04,1980-09-01,/api/citations/19810008208/downloads/19810008208.pdf,CDMS,PUBLIC_USE_PERMITTED,
19810008222,MAN/SYSTEM TECHNOLOGY AND LIFE SUPPORT,Development and fabrication of an advanced liquid cooling garment,"A tube/fin concept liquid cooling garment head cooler was developed, fabricated and delivered to NASA-ARC. The head cooler was fabricated from polyurethane film which sandwiches the transport fluid tubing and a thermally conductive fin material. The head cooler garment is sewn to form a skull cap and covered with a comfort liner. In addition, two Neonate heating garments were fabricated and supplied to NASA for further finishing and use in medical tests. The resulting garment is flexible, elastic and conforms to the head comfortably. Tests on a tube/fin element of identical construction as the head cooler demonstrated good thermal effectiveness. Use of commercially available materials and development of relatively simple fabrication techniques give the potential for a low garment cost.",2013-09-04,1978-03-06,/api/citations/19810008222/downloads/19810008222.pdf,CDMS,GOV_PUBLIC_USE_PERMITTED,
19810008315,SYSTEMS ANALYSIS,FBI fingerprint identification automation study:  AIDS 3 evaluation report.  Volume 9:  Functional requirements,"The current system and subsystem used by the Identification Division are described. System constraints that dictate the system environment are discussed and boundaries within which solutions must be found are described. The functional requirements were related to the performance requirements. These performance requirements were then related to their applicable subsystems. The flow of data, documents, or other pieces of information from one subsystem to another or from the external world into the identification system is described. Requirements and design standards for a computer based system are presented.",2013-09-04,1980-08-15,/api/citations/19810008315/downloads/19810008315.pdf,CDMS,GOV_PUBLIC_USE_PERMITTED,
19810008436,URBAN TECHNOLOGY AND TRANSPORTATION,An investigation of drag reduction for tractor trailer vehicles with air deflector and boattail,"A wind tunnel investigation was conducted to determine the influence of several physical variables on the aerodynamic drag of a trailer model. The physical variables included: a cab mounted wind deflector, boattail on trailer, flow vanes on trailer front, forced transition on trailer, and decreased gap between tractor and trailer. Tests were conducted at yaw angles (relative wind angles) of 0, 5, 10, 20, and 30 degrees and Reynolds numbers of 3.58 x 10 to the 5th power 6.12 x 10 to the 5th power based upon the equivalent diameter of the vehicles. The wind deflector on top of the cab produced a calculated reduction in fuel consumption of about 5 percent of the aerodynamic portion of the fuel budget for a wind speed of 15.3 km/hr (9.5 mph) over a wind angle range of 0 deg to 180 deg and for a vehicle speed of 88.5 km/hr (55 mph). The boattail produced a calculated 7 percent to 8 percent reduction in fuel consumption under the same conditions. The decrease in gap reduced the calculated fuel consumption by about 5 percent of the aerodynamic portion of the fuel budget.",2013-09-04,1981-01-01,/api/citations/19810008436/downloads/19810008436.pdf,CDMS,GOV_PUBLIC_USE_PERMITTED,
19810008441,ASTRONOMY,Submillimeter wave survey of the galactic plane,"The survey measured, over virtually the entire galactic plane, the distribution and basic physical conditions of the coolest dust component of the interstellar medium. The instrument designed for observations of extended, low surface brightness continuum emission consisted of a balloon borne, gyro stablized, 1.2 m Cassegrain telescope and a liquid cooled photometer. The design, integration, tests, and flight operation of the survey are presented.",2013-09-04,1980-12-01,/api/citations/19810008441/downloads/19810008441.pdf,CDMS,GOV_PUBLIC_USE_PERMITTED,
19810008475,AIR TRANSPORTATION AND SAFETY,The use of total simulator training in transitioning air-carrier pilots:  A field evaluation,"A field study was conducted in which the performance of air carrier transitioning pilots who had landing training in a landing maneuver approved simulator was compared with the performance of pilots who had landing training in the aircraft. Forty-eight trainees transitioning to the B-727 aircraft and eighty-seven trainees transitioning to the DC-10 were included in the study. The study results in terms of both objectively measured performance indicants and observer and check-pilot ratings did not demonstrate a clear distinction between the two training groups. The results suggest that, for these highly skilled transitioning pilots, a separate training module in the aircraft may be of dubious value.",2013-09-04,1981-01-01,/api/citations/19810008475/downloads/19810008475.pdf,CDMS,GOV_PUBLIC_USE_PERMITTED,
19810009052,ENERGY PRODUCTION AND CONVERSION,The HEWAC pilot line experience,Advanced silicon solar cells with both electrical contacts on the back side of the cell are described. These high efficiency wrap around contact solar cells (HEWACS) utilize a screen printed dielectric insulation layer to isolate the 'n' and 'p' contacts from each other. Development of a device exhibiting high AMO conversion efficiencies is addressed along with the processing of such cells to a point where cell fabrication can be carried out by production personnel under operating production line conditions.,2013-08-11,1980-01-01,/api/citations/19810009052/downloads/19810009052.pdf,CDMS,GOV_PUBLIC_USE_PERMITTED,19810009009
19810009054,ENERGY PRODUCTION AND CONVERSION,Blanket technology workshop report,"The solar array blanket, defined as a substrate covered with interconnected and glassed solar cells, but excluding the necessary support structure, deployment, and orientation devices is considered. The interactions between the blanket and the structure that is used to package, deploy, support and, if necessary restow it, are addressed along with systems constraints such as spacecraft configuration, size, and payload requirements. The influence on blanket design is emphasized. The three main mission classes considered are low Earth orbital (LEO), intermediate, or LEO to GEO transfer, and geosynchronous (GEO). Although interplanetary missions could be considered to be a separate class, their requirements, primarily power per unit mass, are generally close enough to geosynchronous missions to allow this mission class to be included within the third type. Examination of the critical elements of each class coupled with considerations of the shuttle capabilities is used to define the type of blanket technology most likely required to support missions that will be flown starting in 1990.",2013-08-11,1980-01-01,/api/citations/19810009054/downloads/19810009054.pdf,CDMS,GOV_PUBLIC_USE_PERMITTED,19810009009
19810009100,ENVIRONMENT POLLUTION,"Transport jet aircraft noise abatement in foreign countries: Growth, structure, impact. Volume 1: Europe, July 1980","The development and implementation of aircraft noise control regulations in various European states are described. The countries include the United Kingdom, France, Switzerland, Federal Republic of Germany, Sweden, Denmark, and the Netherlands. Topics discussed include noise monitoring, airport curfews, land use planning, and the government structure for noise regulation.",2013-09-04,1980-07-01,/api/citations/19810009100/downloads/19810009100.pdf,CDMS,GOV_PUBLIC_USE_PERMITTED,
19810008562,AIRCRAFT PROPULSION AND POWER,Model aerodynamic test results for two variable cycle engine coannular exhaust systems at simulated takeoff and cruise conditions.  Comprehensive data report.  Volume 2:  Tabulated aeroynamic data book 1,"Tabulated data from wind tunnel tests conducted to evaluate the aerodynamic performance of an advanced coannular exhaust nozzle for a future supersonic propulsion system are presented. Tests were conducted with two test configurations: (1) a short flap mechanism for fan stream control with an isentropic contoured flow splitter, and (2) an iris fan nozzle with a conical flow splitter. Both designs feature a translating primary plug and an auxiliary inlet ejector. Tests were conducted at takeoff and simulated cruise conditions. Data were acquired at Mach numbers of 0, 0.36, 0.9, and 2.0 for a wide range of nozzle operating conditions. At simulated supersonic cruise, both configurations demonstrated good performance, comparable to levels assumed in earlier advanced supersonic propulsion studies. However, at subsonic cruise, both configurations exhibited performance that was 6 to 7.5 percent less than the study assumptions. At takeoff conditions, the iris configuration performance approached the assumed levels, while the short flap design was 4 to 6 percent less. Data are provided through test run 25.",2013-09-04,1981-01-01,/api/citations/19810008562/downloads/19810008562.pdf,CDMS,GOV_PUBLIC_USE_PERMITTED,
19810009363,OPTICS,System for forming a quadrified image comprising angularly related fields of view of a three dimensional object,"A system for generating, within a single frame of photographic film, a quadrified image including images of angularly (including orthogonally) related fields of view of a near field three dimensional object is described. It is characterized by three subsystems each of which includes a plurality of reflective surfaces for imaging a different field of view of the object at a different quadrant of the quadrified image. All of the subsystems have identical path lengths to the object photographed.",2013-09-04,1980-07-22,/api/citations/19810009363/downloads/19810009363.pdf,CDMS,GOV_PUBLIC_USE_PERMITTED,
19810009364,OPTICS,Double-beam optical method and apparatus for measuring thermal diffusivity and other molecular dynamic processes in utilizing the transient thermal lens effect,"A sample material was irradiated by relatively high power, short pulses from a dye laser. Energy from the pulses was absorbed by the sample material, thereby forming a thermal lens in the area of absorption. The pulse repetition rate was chosen so that the thermal lens is substantially dissipated by the time the next pulse reaches the sample material. A probe light beam, which in a specific embodiment is a relatively low power, continuous wave (cw) laser beam, irradiated the thermal lens formed in the sample material. The intensity characteristics of the probe light beam subsequent to irradiation of the thermal lens is related to changes in the refractive index of the sample material as the thermal lens is formed and dissipated.",2013-09-04,1981-01-06,/api/citations/19810009364/downloads/19810009364.pdf,CDMS,GOV_PUBLIC_USE_PERMITTED,
