document_id,subjectCategories,title,abstract,createDate,publicationDate,downloads_pdf,center,copyright,related19810011498,AERODYNAMICS,A computer technique for detailed analysis of mission radius and maneuverability characteristics of fighter aircraft,"A computer technique to determine the mission radius and maneuverability characteristics of combat aircraft was developed. The technique was used to determine critical operational requirements and the areas in which research programs would be expected to yield the most beneficial results. In turn, the results of research efforts were evaluated in terms of aircraft performance on selected mission segments and for complete mission profiles. Extensive use of the technique in evaluation studies indicates that the calculated performance is essentially the same as that obtained by the proprietary programs in use throughout the aircraft industry.",2013-09-04,1981-03-01,/api/citations/19810011498/downloads/19810011498.pdf,CDMS,GOV_PUBLIC_USE_PERMITTED,
19810011499,AERODYNAMICS,Total main rotor isolation system analysis,"Requirements, preliminary design, and verification procedures for a total main rotor isolation system at n/rev are presented. The fuselage is isolated from the vibration inducing main rotor at one frequency in all degrees of freedom by four antiresonant isolation units. Effects of parametric variations on isolation system performance are evaluated.",2013-09-04,1981-03-01,/api/citations/19810011499/downloads/19810011499.pdf,CDMS,GOV_PUBLIC_USE_PERMITTED,
19810011522,AIRCRAFT COMMUNICATIONS AND NAVIGATION,Operational considerations in utilization of microwave landing system approach and landing guidance,"The characteristics of microwave landing system (MLS) equipment are reviewed and the flight performance of the terminal configured vehicle B-737 airplane during nearly five years of flight experience with MLS is summarized. Most of these flights involved curved, descending flight paths with automatic landings and final approaches as short as 0.44 n. mi. Possible uses to solve noise abatement problems with MLS equipment of varying degrees of complexity are discussed. It is concluded that altitude derived from MLS is superior to other sources near the airport traffic pattern.",2013-09-04,1981-03-01,/api/citations/19810011522/downloads/19810011522.pdf,CDMS,GOV_PUBLIC_USE_PERMITTED,
19810011537,"AIRCRAFT DESIGN, TESTING AND PERFORMANCE",Investigation of Flight Test Methods for measuring the performance of general aviation aircraft,A theoretical and experimental investigation of methods for measuring the performance of general aviation airplanes was conducted using relatively simple instrumentation currently available and data extraction techniques established from efforts in other disciplines. The possibilities of improving flight test data by use of improved modern instrumentation and digital data recording and data analysis were considered.,2013-09-04,1981-01-01,/api/citations/19810011537/downloads/19810011537.pdf,CDMS,GOV_PUBLIC_USE_PERMITTED,
19810011551,AIRCRAFT PROPULSION AND POWER,Aerodynamics of advanced axial-flow turbomachinery,"A multi-task research program on aerodynamic problems in advanced axial-flow turbomachine configurations was carried out at Iowa State University. The elements of this program were intended to contribute directly to the improvement of compressor, fan, and turbine design methods. Experimental efforts in intra-passage flow pattern measurements, unsteady blade row interaction, and control of secondary flow are included, along with computational work on inviscid-viscous interaction blade passage flow techniques. This final report summarizes the results of this program and indicates directions which might be taken in following up these results in future work. In a separate task a study was made of existing turbomachinery research programs and facilities in universities located in the United States. Some potentially significant research topics are discussed which might be successfully attacked in the university atmosphere.",2013-09-04,1980-11-30,/api/citations/19810011551/downloads/19810011551.pdf,CDMS,GOV_PUBLIC_USE_PERMITTED,
19810010593,AIRCRAFT PROPULSION AND POWER,QCGAT mixer compound exhaust system design and static big model test report,"A mixer exhaust system was designed to meet the proposed performance and exhaust jet noise goals for the AiResearch QCGAT engine. Some 0.35 scale models of the various nozzles were fabricated and aerodynamically and acoustically tested. Preliminary optimization, engine cycle matching, model test data and analysis are presented. A final mixer exhaust system is selected for optimum performance for the overall flight regime.",2013-09-04,1978-10-31,/api/citations/19810010593/downloads/19810010593.pdf,CDMS,GOV_PUBLIC_USE_PERMITTED,
19810010610,RESEARCH AND SUPPORT FACILITIES (AIR),Simulation and control engineering studies of NASA-Ames 40 foot by 80 foot/80 foot by 120 foot wind tunnels,The development and use of a digital computer simulation of the proposed wind tunnel facility is described. The feasibility of automatic control of wind tunnel airspeed and other parameters was examined. Specifications and implementation recommendations for a computer based automatic control and monitoring system are presented.,2013-09-04,1978-05-26,/api/citations/19810010610/downloads/19810010610.pdf,CDMS,GOV_PUBLIC_USE_PERMITTED,
19810010611,RESEARCH AND SUPPORT FACILITIES (AIR),Rotative balance of the I.M.F. Lille and associated experimental techniques,"The study of aerodynamic effects at high incidence associated with motions of wide amplitude incorporating continuous rotations requires the consideration of coupled effects, which are generally nonlinear, in a formulation of equations of motion. A rotative balance designed to simulate such maneuvers in a windtunnel was created to form a test medium for analytical studies. A general description of the assembly is provided by considering two main ranges of application. The capacities and performance of the assembly are discussed.",2013-09-04,1981-01-01,/api/citations/19810010611/downloads/19810010611.pdf,CDMS,GOV_PUBLIC_USE_PERMITTED,
19810010623,ASTRONAUTICS (GENERAL),Float zone silicon for IR detectors,An overview of the state of the art of processing silicon for use as infrared detectors is presented. Improvements in the process that could be obtained in a low-g environment were examined. The various requirements for the different types of Si detector materials are summarized.,2013-08-11,1980-12-01,,CDMS,GOV_PUBLIC_USE_PERMITTED,19810010617
19810010628,ASTRONAUTICS (GENERAL),Ripplon scattering using grating heterodyne spectroscopy,"Heterodyne photon spectroscopy was used for the study of the viseo-elastic properties of the liquid interface by studying the scattering from thermal ripplons. A theory of a heterodyne apparatus based on a grating is presented, and the heterodyne condition is given in terms of the parameters of the experimental set-up. Emphasis was placed on the study of the instrumental function and its influence on the measurement data. The instrumental function is not always gaussian, but its functional form depends on the parameters of the experimental set-up. An algorithm is suggested to arrive at the center frequency and half width at half height of the spectrum from the noisy experimental data, and applied to the measurement data obtained from ethanol and water surfaces.",2013-08-11,1980-12-01,,CDMS,GOV_PUBLIC_USE_PERMITTED,19810010617
19810010654,LAUNCH VEHICLES AND SPACE VEHICLES,Space Platform advanced technology study,"The development of mechanical systems for space platforms which have universal application regardless of what platform configuration is built is discussed. The design requirements and fabrication of the orbiter berthing systems, berthing latch interface, berthing umbilical interface, and adaptive end effector are described.",2013-08-11,1981-02-01,,CDMS,GOV_PUBLIC_USE_PERMITTED,19810010637
19810010658,LAUNCH VEHICLES AND SPACE VEHICLES,Environmental effects and large space systems,"When planning large scale operations in space, environmental impact must be considered in addition to radiation, spacecraft charging, contamination, high power and size. Pollution of the atmosphere and space is caused by rocket effluents and by photoelectrons generated by sunlight falling on satellite surfaces even light pollution may result (the SPS may reflect so much light as to be a nuisance to astronomers). Large (100 Km 2) structures also will absorb the high energy particles that impinge on them. Altogether, these effects may drastically alter the Earth's magnetosphere. It is not clear if these alterations will in any way affect the Earth's surface climate. Large structures will also generate large plasma wakes and waves which may cause interference with communications to the vehicle. A high energy, microwave beam from the SPS will cause ionospheric turbulence, affecting UHF and VHF communications. Although none of these effects may ultimately prove critical, they must be considered in the design of large structures.",2013-08-11,1981-02-01,,CDMS,GOV_PUBLIC_USE_PERMITTED,19810010637
19810010663,LAUNCH VEHICLES AND SPACE VEHICLES,Antenna systems requirements definition study,"A plan to use a 55m wrap rib antenna in a second generation land mobile satellite service application as a specific mission to define a large space structure technology system and its interfaces is described. The system design aims to examine the launch phase of the mission including interface with the space transportation system and the orbital transfer vehicle, and the deployment from the spacecraft of the boom, antennas, and solar panels. Methods for determining the effect of system configuration on the interfaces and of the space environment and operational events on the system and its subsystem interfaces are discussed.",2013-08-11,1981-02-01,,CDMS,GOV_PUBLIC_USE_PERMITTED,19810010637
19810010705,COMPOSITE MATERIALS,"Advanced composite aileron for L-1011 transport aircraft, task 1","Structural design and maintainability criteria were established and used as a guideline for evaluating a variety of configurations and materials for each of the major subcomponents. From this array of subcomponent designs, several aileron assemblies were formulated and analyzed. The selected design is a multirib configuration with sheet skin covers mechanically fastened to channel section ribs and spars. Qualitative analysis of currently available composite material systems led to the selection of three candidate materials on which comparative structural tests were conducted to measure the effects of environment and impact damage on mechanical property retention. In addition, each system was evaluated for producibility characteristics. From these tests, Thornel 300/5208 unidirectional tape was selected for the front spar and covers, and Thornel 300 fabric/5208 was chosen for the ribs.",2013-09-04,1978-07-01,/api/citations/19810010705/downloads/19810010705.pdf,CDMS,GOV_PUBLIC_USE_PERMITTED,
19810010751,METALLIC MATERIALS,Simultaneous ion sputter polishing and deposition,"Results of experiments to study ion beam sputter polishing in conjunction with simultaneous deposition as a mean of polishing copper surfaces are presented. Two types of simultaneous ion sputter polishing and deposition were used in these experiments. The first type utilized sputter polishing simultaneous with vapor deposition, and the second type utilized sputter polishing simultaneous with sputter deposition. The etch and deposition rates of both techniques were studied, as well as the surface morphology and surface roughness.",2013-09-04,1981-01-01,/api/citations/19810010751/downloads/19810010751.pdf,CDMS,GOV_PUBLIC_USE_PERMITTED,
19810010789,PROPELLANTS AND FUELS,An assessment of the use of antimisting fuel in turbofan engines,The effects of antimisting kerosene on the performance of the components from the fuel system and the combustor of a JT8D aircraft engine were evaluated. The problems associated with antimisting kerosene were identified and the extent of shearing or degradation required to allow the engine components to achieve satisfactory operation were determined. The performance of the combustor was assessed in a high pressure facility and in an altitude relight/cold ignition facility. The performance of the fuel pump and control system was evaluated in an open loop simulation.,2013-09-04,1980-11-01,/api/citations/19810010789/downloads/19810010789.pdf,CDMS,GOV_PUBLIC_USE_PERMITTED,
19810011801,COMMUNICATIONS AND RADAR,"A theoretical study of microwave beam absorption by a rectenna, introduction","The conditions required for a large rectenna array (i.e., reference design) to absorb nearly 100% of transmitted energy were studied. Design parameters including element spacing, and the manner in which these affect scatter were formulated. Amplitudes and directions of scatter and development of strategies for mitigation were also investigated. The effects on rectenna behavior of external factors such as weather and aircraft overflights were determined.",2013-08-11,1981-01-14,,CDMS,GOV_PUBLIC_USE_PERMITTED,19810011800
19810011804,COMMUNICATIONS AND RADAR,Waveguide model,"A model is presented which quantifies the electromagnetic modes (field configurations) in the immediate vicinity of the rectenna element. Specifically, the waveguide model characterizes the electromagnetic modes generated by planar waves normal to the array. The model applies only to incidence normal to the array.",2013-08-11,1981-01-14,,CDMS,GOV_PUBLIC_USE_PERMITTED,19810011800
19810011824,ELECTRONICS AND ELECTRICAL ENGINEERING,Controller for computer control of brushless dc motors,A motor speed and torque controller for brushless d.c. motors provides an unusually smooth torque control arrangement. The controller provides a means for controlling a current waveform in each winding of a brushless dc motor by synchronization of an excitation pulse train from a programmable oscillator. Sensing of torque for synchronization is provided by a light beam chopper mounted on the motor rotor shaft. Speed and duty cycle are independently controlled by controlling the frequency and pulse width output of the programmable oscillator. A means is also provided so that current transitions from one motor winding to another is effected without abrupt changes in output torque.,2013-09-04,1981-02-03,/api/citations/19810011824/downloads/19810011824.pdf,CDMS,GOV_PUBLIC_USE_PERMITTED,
19810011894,MECHANICAL ENGINEERING,Life analysis of multiroller planetary traction drive,"A contact fatigue life analysis was performed for a constant ratio, Nasvytis Multiroller Traction Drive. The analysis was based on the Lundberg-Palmgren method for rolling element bearing life prediction. Life adjustment factors for materials, processing, lubrication and traction were included. The 14.7 to 1 ratio drive consisted of a single stage planetary configuration with two rows of stepped planet rollers of five rollers per row, having a roller cluster diameter of approximately 0.21 m, a width of 0.06 m and a weight of 9 kg. Drive system 10 percent life ranged from 18,800 hours at 16.6 kW (22.2 hp) and 25,000 rpm sun roller speed, to 305 hours at maximum operating conditions of 149 kw (200 hp) and 75,000 rpm sun roller speed. The effect of roller diameter and roller center location on life were determined. It was found that an optimum life geometry exists.",2013-09-04,1981-04-01,/api/citations/19810011894/downloads/19810011894.pdf,CDMS,GOV_PUBLIC_USE_PERMITTED,
19810011895,MECHANICAL ENGINEERING,Sputtering and ion plating for aerospace applications,"Sputtering and ion plating technologies are reviewed in terms of their potential and present uses in the aerospace industry. Sputtering offers great universality and flexibility in depositing any material or in the synthesis of new ones. The sputter deposition process has two areas of interest: thin film and fabrication technology. Thin film sputtering technology is primarily used for aerospace mechanical components to reduce friction, wear, erosion, corrosion, high temperature oxidation, diffusion and fatigue, and also to sputter-construct temperature and strain sensors for aircraft engines. Sputter fabrication is used in intricate aircraft component manufacturing. Ion plating applications are discussed in terms of the high energy evaporant flux and the high throwing power. Excellent adherence and 3 dimensional coverage are the primary attributes of this technology.",2013-09-04,1981-01-01,/api/citations/19810011895/downloads/19810011895.pdf,CDMS,GOV_PUBLIC_USE_PERMITTED,
19810011966,EARTH RESOURCES AND REMOTE SENSING,Critical parameters for coarse coal underground slurry haulage systems,"Factors are identified which must be considered in meeting the requirements of a transportation system for conveying, in a pipeline, the coal mined by a continuous mining machine to a storage location neat the mine entrance or to a coal preparation plant located near the surface. For successful operation, the slurry haulage the system should be designed to operated in the turbulent flow regime at a flow rate at least 30% greater than the deposition velocity (slurry flow rate at which the solid particles tend to settle in the pipe). The capacity of the haulage system should be compatible with the projected coal output. Partical size, solid concentration, density, and viscosity of the suspension are if importance as well as the selection of the pumps, pipes, and valves. The parameters with the greatest effect on system performance ar flow velocity, pressure coal particle size, and solids concentration.",2013-09-04,1981-02-15,/api/citations/19810011966/downloads/19810011966.pdf,CDMS,GOV_PUBLIC_USE_PERMITTED,
19810012109,GEOPHYSICS,Structure of the low latitude boundary layer,"Observations at high temporal resolution of the frontside magnetopause and plasma boundary layer, made with the LASL/MPE fast plasma analyzer onboard the ISEE 1 and 2 spacecraft, revealed a complex quasiperiodic structure of some of the observed boundary layers. A cool tailward streaming boundary layer plasma was seen intermittently, with intervening periods of hot tenuous plasma which has properties similar to the magnetospheric population. While individual encounters with the boundary layer plasma last only a few minutes, the total observation time may extend over one hour or more.",2013-09-04,1980-09-01,/api/citations/19810012109/downloads/19810012109.pdf,CDMS,GOV_PUBLIC_USE_PERMITTED,
19810012110,GEOPHYSICS,Research of the state of convection in the Earth's mantle,"The behavior and mechanical properties of the lithosphere are studied. Geoid heights derived from the GEOS 3 and SEASAT radar altimeters were used. The following predictive capabilities are discussed: location of unknown seamounts from the knowledge of the geoid heights; prediction of gravity field from the knowledge of the topography and past history of the relief; or insight into the history of a region from the knowledge of both topography and geoid heights. Several geographical areas were studied, including the Walvis Ridge and Rio Grande Rise in the Southern Atlantic Ocean and several seamount chains in the Central Pacific Ocean. Two main factors influence geoid height: conditions of creation and age of the lithosphere at the time of loading.",2013-09-04,1981-03-01,/api/citations/19810012110/downloads/19810012110.pdf,CDMS,GOV_PUBLIC_USE_PERMITTED,
19810012111,GEOPHYSICS,Analogs of Martian eolian features in southwestern Egypt,"Emphasis was placed on the morphology and patterns of streaks in the Uweinat region, the relationship of topography to streak patterns, and correlation of field and laboratory studies of the desert surface sediments with color and tonal variations seen from orbit. The research objectives were to provide the necessary groundtruth information on terrestrial eolian features in order to properly interpret the orbital data and to use the interpretations as a basis for investigation of Martian eolian features.",2013-09-04,1981-04-01,/api/citations/19810012111/downloads/19810012111.pdf,CDMS,GOV_PUBLIC_USE_PERMITTED,
19810012135,METEOROLOGY AND CLIMATOLOGY,Analysis of the inversion monitoring  capabilities of a monostatic acoustic radar in complex terrain,"A qualitative interpretation of the records from a monostatic acoustic radar is presented. This is achieved with the aid of airplane, helicopter, and rawinsonde temperature soundings. The diurnal structure of a mountain valley circulation pattern is studied with the use of two acoustic radars, one located in the valley and one on the downwind ridge. The monostatic acoustic radar was found to be sufficiently accurate in locating the heights of the inversions and the mixed layer depth to warrant use by industry even in complex terrain.",2013-09-04,1981-04-01,/api/citations/19810012135/downloads/19810012135.pdf,CDMS,GOV_PUBLIC_USE_PERMITTED,
19810012166,LIFE SCIENCES (GENERAL),Morphological changes in neurons of the hind limb reflex arc during long term immobilization,"Twelve adult rabbits were immobilized for 9 to 31 days, followed by histological study of the nerve processes of lumbar vertebra 7 and sacral vertebra 1, the sciatic nerve and the motor endings of the thigh muscles. In the spinal ganglia, dystrophic changes of increasing severity with immobilization time were found, including pericellular edema, vacuolized neuroplasm, pycnotic changes, cytolysis and destruction. Chromatophilic matter decreased and was partly bleached, and amitotic division occurred. A portion of the sciatic nerve fibers were argentophilic, and some fragmentary decomposition occurred. Considerable dystrophic changes occurred in the motor nerve endings.",2013-09-04,1980-06-01,/api/citations/19810012166/downloads/19810012166.pdf,CDMS,GOV_PUBLIC_USE_PERMITTED,
19810012182,AEROSPACE MEDICINE,Instantaneous stroke volume by PDE during and after constant LBNP (-50 torr),"Six male subjects were exposed to -50 torr lower body negative pressure (LBNP) for 10 min while stroke volume was recorded beat by beat at regular intervals before, during and after release of LBNP. Stroke volume was calculated from the systolic velocity integral in the ascending aorta by pulsed Doppler echocardiography (PDE) and the cross sectional area of the vessel by M mode echocardiography. Changes in leg volume were recorded continuously and blood pressure was taken every minute. Stroke volume dropped by 51% of the control in the first 33 sec of LBNP and continued to decline slowly to -62% toward the end. Heart rate increased by 15% in the first 10 sec and was 22% above control at the end of exposure. The resulting cardiac output closely followed the course of stroke volume (-47% at 33 sec, -53% at 8 min) showing that the modest increase in heart rate did little to offset the drop in stroke volume. Leg volume increased markedly within the first 10 sec with a more gradual rise reaching +3.5% at the end. Upon sudden release of LBNP, leg volume dropped significantly during the first 3 sec simultaneously with an increase in stroke volume followed by a substantial decline in heart rate below the baseline.",2013-08-11,1980-07-01,,CDMS,GOV_PUBLIC_USE_PERMITTED,19810012178
19810012193,AEROSPACE MEDICINE,Development of a new noninvasive method to determine the integrity of bone in vivo,"An electromagnetic sensor for monitoring elastic waves in bone was developed. It does not require the use of traction pins and the output is not affected by soft tissue properties, a difficulty commonly encountered when using ultrasonic and vibration methods to determine in vivo properties of bone.",2013-09-04,1980-11-10,/api/citations/19810012193/downloads/19810012193.pdf,CDMS,GOV_PUBLIC_USE_PERMITTED,
19810012202,MAN/SYSTEM TECHNOLOGY AND LIFE SUPPORT,Lightside Atmospheric Revitalization System,"The system was studied as a replacement to the present baseline LiOH system for extended duration shuttle missions. The system consists of three subsystems: a solid amine water desorbed regenerable carbon dioxide removal system, a water vapor electrolysis oxygen generating system, and a Sabatier reactor carbon dioxide reduction system. The system is designed for use on a solar powered shuttle vehicle. The majority of the system's power requirements are utilized on the Sun side of each orbit, when solar power is available.",2013-09-04,1980-10-01,/api/citations/19810012202/downloads/19810012202.pdf,CDMS,GOV_PUBLIC_USE_PERMITTED,
